{
  "schema_version": 1,
  "id": "PROJECT-XNN-TRANSFER",
  "title": "XnnTransfer project blueprint",
  "mission": "Deliver direct, explicit, secure, cross-platform file transfer between peers on the same LAN without weakening hostile-input, persistence, or delivery guarantees.",
  "state_order": [
    "absent",
    "specified",
    "implemented",
    "qualified"
  ],
  "goals": [
    {
      "id": "GOAL-DIRECT-LAN-TRANSFER",
      "title": "Direct LAN file transfer",
      "statement": "Users can discover, authenticate, and transfer files directly on a LAN across supported desktop platforms.",
      "milestones": [
        "MS-FOUNDATION",
        "MS-P1-VERTICAL-SLICE",
        "MS-P1-PRODUCTION",
        "MS-P2-HARDENING"
      ]
    },
    {
      "id": "GOAL-ENGINEERING-INTEGRITY",
      "title": "Auditable engineering integrity",
      "statement": "Every product increment is derived from one project model and accepted from immutable exact-candidate evidence.",
      "milestones": [
        "MS-GOVERNANCE"
      ]
    }
  ],
  "milestones": [
    {
      "id": "MS-FOUNDATION",
      "title": "Contracts and runtime foundation",
      "sequence": 10,
      "outcomes": [
        "OUT-PROTOCOL-V1-CONTRACT",
        "OUT-C-ABI-EVENT-MODEL",
        "OUT-NATIVE-PACKAGING"
      ]
    },
    {
      "id": "MS-P1-VERTICAL-SLICE",
      "title": "P1 authenticated one-file vertical slice",
      "sequence": 20,
      "outcomes": [
        "OUT-P1-DISCOVERY",
        "OUT-P1-PAIRING",
        "OUT-P1-ONE-FILE-TRANSFER",
        "OUT-P1-FLUTTER-FLOW",
        "OUT-P1-CANCELLATION",
        "OUT-STORAGE-PORTABLE-WINDOWS-PATHS"
      ]
    },
    {
      "id": "MS-P1-PRODUCTION",
      "title": "P1 production transfer behavior",
      "sequence": 30,
      "outcomes": [
        "OUT-P1-MULTI-FILE",
        "OUT-P1-SCHEDULING",
        "OUT-P1-RESUME",
        "OUT-P1-COLLISION",
        "OUT-P1-ADVERSE-PLATFORM"
      ]
    },
    {
      "id": "MS-P2-HARDENING",
      "title": "P2 hardening and release",
      "sequence": 40,
      "outcomes": [
        "OUT-P2-FUZZING",
        "OUT-P2-INTEROPERABILITY",
        "OUT-P2-SIGNED-PACKAGING",
        "OUT-P2-PRIVACY",
        "OUT-P2-PERFORMANCE"
      ]
    },
    {
      "id": "MS-GOVERNANCE",
      "title": "Project governance and delivery control",
      "sequence": 5,
      "outcomes": [
        "OUT-HARNESS-V2-CONTROL-PLANE",
        "OUT-HARNESS-V2-PILOT",
        "OUT-HARNESS-V2-PILOT-REPORT",
        "OUT-HARNESS-BRANCH-RECLAMATION",
        "OUT-PROJECT-SEMANTIC-BASELINE"
      ]
    }
  ],
  "capabilities": [
    {
      "id": "CAP-PROTOCOL",
      "title": "Bounded wire protocol",
      "depends_on": [],
      "implementation_units": [
        "UNIT-PROTOCOL-CONTRACT",
        "UNIT-NATIVE-PROTOCOL"
      ]
    },
    {
      "id": "CAP-DISCOVERY",
      "title": "Untrusted LAN discovery",
      "depends_on": [
        "CAP-PROTOCOL"
      ],
      "implementation_units": [
        "UNIT-NATIVE-DISCOVERY"
      ]
    },
    {
      "id": "CAP-IDENTITY",
      "title": "Protected peer identity",
      "depends_on": [],
      "implementation_units": [
        "UNIT-NATIVE-IDENTITY"
      ]
    },
    {
      "id": "CAP-SESSION",
      "title": "Authenticated encrypted session",
      "depends_on": [
        "CAP-PROTOCOL",
        "CAP-IDENTITY"
      ],
      "implementation_units": [
        "UNIT-NATIVE-TLS",
        "UNIT-NATIVE-SESSION"
      ]
    },
    {
      "id": "CAP-STORAGE",
      "title": "Safe destination storage",
      "depends_on": [],
      "implementation_units": [
        "UNIT-NATIVE-STORAGE"
      ]
    },
    {
      "id": "CAP-TRANSFER",
      "title": "Verified file transfer",
      "depends_on": [
        "CAP-PROTOCOL",
        "CAP-SESSION",
        "CAP-STORAGE"
      ],
      "implementation_units": [
        "UNIT-NATIVE-TRANSFER"
      ]
    },
    {
      "id": "CAP-BRIDGE",
      "title": "Versioned asynchronous C ABI",
      "depends_on": [
        "CAP-DISCOVERY",
        "CAP-SESSION",
        "CAP-TRANSFER"
      ],
      "implementation_units": [
        "UNIT-NATIVE-CORE-BRIDGE"
      ]
    },
    {
      "id": "CAP-FLUTTER",
      "title": "Desktop user workflow",
      "depends_on": [
        "CAP-BRIDGE"
      ],
      "implementation_units": [
        "UNIT-FLUTTER-NATIVE-ADAPTER",
        "UNIT-FLUTTER-TRANSFER-FEATURE"
      ]
    },
    {
      "id": "CAP-PACKAGING",
      "title": "Cross-platform packaging",
      "depends_on": [
        "CAP-BRIDGE",
        "CAP-FLUTTER"
      ],
      "implementation_units": [
        "UNIT-BUILD-PACKAGING"
      ]
    },
    {
      "id": "CAP-HARNESS",
      "title": "Exact-candidate delivery control",
      "depends_on": [],
      "implementation_units": [
        "UNIT-HARNESS"
      ]
    },
    {
      "id": "CAP-PROJECT-MODEL",
      "title": "Global project semantic model",
      "depends_on": [
        "CAP-HARNESS"
      ],
      "implementation_units": [
        "UNIT-PROJECT-MODEL"
      ]
    }
  ],
  "outcomes": [
    {
      "id": "OUT-PROTOCOL-V1-CONTRACT",
      "title": "Versioned bounded protocol contract",
      "milestone": "MS-FOUNDATION",
      "capability": "CAP-PROTOCOL",
      "statement": "Version 1 framing, negotiation, transcript order, and limits are specified and validated against hostile vectors.",
      "depends_on": [],
      "invariants": [
        "INV-BOUNDED-HOSTILE-INPUT",
        "INV-AUTH-BEFORE-METADATA"
      ],
      "criteria": [
        {
          "id": "CRIT-BP-PROTOCOL-V1",
          "statement": "The versioned protocol specification and vectors define bounded parsing, negotiation, and transcript failure behavior.",
          "negative_definitions": [
            "Parser acceptance without protocol ordering does not qualify.",
            "An unbounded field or collection does not qualify."
          ]
        }
      ],
      "target_state": "qualified",
      "deferred_reason": "Existing historical evidence must be requalified against the Blueprint before this outcome is current."
    },
    {
      "id": "OUT-C-ABI-EVENT-MODEL",
      "title": "Asynchronous versioned C ABI",
      "milestone": "MS-FOUNDATION",
      "capability": "CAP-BRIDGE",
      "statement": "Flutter observes native operations only through a versioned asynchronous C ABI with explicit ownership and bounded event delivery.",
      "depends_on": [],
      "invariants": [
        "INV-FLUTTER-C-ABI-ONLY",
        "INV-SINGLE-ENGINE-OWNER",
        "INV-BOUNDED-HOSTILE-INPUT"
      ],
      "criteria": [
        {
          "id": "CRIT-BP-C-ABI",
          "statement": "The frozen caller remains ABI compatible and native shutdown prevents callbacks after the shutdown barrier.",
          "negative_definitions": [
            "Passing only a same-version caller does not qualify.",
            "Borrowed native memory crossing the ABI does not qualify."
          ]
        }
      ],
      "target_state": "qualified",
      "deferred_reason": "Existing historical evidence must be requalified against the Blueprint before this outcome is current."
    },
    {
      "id": "OUT-NATIVE-PACKAGING",
      "title": "Cross-platform native library packaging",
      "milestone": "MS-FOUNDATION",
      "capability": "CAP-PACKAGING",
      "statement": "Linux, macOS, and Windows desktop bundles load the project native library through the supported adapter.",
      "depends_on": [
        {
          "outcome": "OUT-C-ABI-EVENT-MODEL",
          "minimum_state": "implemented"
        }
      ],
      "invariants": [
        "INV-FLUTTER-C-ABI-ONLY",
        "INV-CANONICAL-MODULES"
      ],
      "criteria": [
        {
          "id": "CRIT-BP-NATIVE-PACKAGING",
          "statement": "Each supported desktop platform builds, bundles, loads, and smoke-tests the canonical native library.",
          "negative_definitions": [
            "Building without loading the bundled library does not qualify.",
            "Using a system dependency fallback does not qualify."
          ]
        }
      ],
      "target_state": "qualified",
      "deferred_reason": "Packaging is implemented but requires Blueprint qualification evidence."
    },
    {
      "id": "OUT-P1-DISCOVERY",
      "title": "LAN peer discovery",
      "milestone": "MS-P1-VERTICAL-SLICE",
      "capability": "CAP-DISCOVERY",
      "statement": "Peers are discovered and expired across interface changes without treating reachability as identity.",
      "depends_on": [
        {
          "outcome": "OUT-PROTOCOL-V1-CONTRACT",
          "minimum_state": "implemented"
        }
      ],
      "invariants": [
        "INV-DISCOVERY-IS-UNTRUSTED",
        "INV-BOUNDED-HOSTILE-INPUT",
        "INV-SINGLE-ENGINE-OWNER"
      ],
      "criteria": [
        {
          "id": "CRIT-BP-P1-DISCOVERY",
          "statement": "Discovery handles expiry and interface changes while exposing only untrusted peer candidates.",
          "negative_definitions": [
            "Treating an announcement as authenticated identity does not qualify.",
            "Retaining a peer beyond bounded expiry does not qualify."
          ]
        }
      ],
      "target_state": "qualified",
      "deferred_reason": "The concrete implementation requires requalification and cross-platform interface evidence."
    },
    {
      "id": "OUT-P1-PAIRING",
      "title": "Authenticated peer pairing",
      "milestone": "MS-P1-VERTICAL-SLICE",
      "capability": "CAP-SESSION",
      "statement": "Users explicitly pair peers and bind protected identity to the authenticated TLS transport.",
      "depends_on": [
        {
          "outcome": "OUT-PROTOCOL-V1-CONTRACT",
          "minimum_state": "implemented"
        }
      ],
      "invariants": [
        "INV-AUTH-BEFORE-METADATA",
        "INV-NO-SECRET-STORAGE-FALLBACK",
        "INV-BOUNDED-HOSTILE-INPUT"
      ],
      "criteria": [
        {
          "id": "CRIT-BP-P1-PAIRING",